"name";"location";"address";"address2";"city";"state";"zip";"phone";"phone_ext";"county";"email";"status";"type";"contact_firstname";"contact_lastname";"age_range";"transportation";"website";"accreditation";"daysopen";"hoursopen";"typeofcare";"language";"introduction";"additionalInfo";"pricing";"is_afterschool";"is_camp";"logo";"schools_served"
"The Park School After-School Program";;"171 GODDARD AVENUE";;"BROOKLINE";"MA";"02445";"617-277-2456";;"NORFOLK";"info@parkschool.org";;;;;;;"https://www.parkschool.org/";;;;;;"The After-School Program provides a safe, relaxed, nurturing, and non-academic setting for children at Park in Pre-Kindergarten through Grade V. With its own separate ten-member staff and well-equipped facility, ASP offers a cheerful environment where children can participate in a variety of creative projects and indoor and outdoor play. Families who desire a longer day for their children may elect, at additional cost, to stay up until 6 p.m. every day or for a few days each week. Time at our After-School Program is an appropriate balance of supervised free play, quiet time for reading and homework, and structured activities in which children can explore their own interests and develop friendships. Children who stay at ASP between 3 - 4:30 p.m. enjoy a variety of ""clubs,"" creative activities that rotate every four weeks. Cooking, jewelry making, drama, sewing, clay, and arts and crafts are among the favorite choices. Upper Division students can participate in an optional Tuesday After-School Program that includes time for games, activities, and (weather permitting) outside play as well as a study hall. From 2 - 4:30 p.m. the students will be in the main building, and at 4:30, they will join the younger students at the ASP building. ";;;"YES";"NO";;
"Fall Brook Child Development Center After School Care";;"12 CROSSROADS DRIVE";;"EAST FREETOWN";"MA";" 02717";"508-763-1911";;"BRISTOL";;;;;;;;"http://fallbrookchilddevctr.com/";;;;;;"You don’t need to sacrifice your livelihood to give your child a quality education.It’s tough not to worry about your kids while they’re at school, let alone during their after-school hours. Fall Brook provides after-school care to help put your mind at ease As a child care center, we realize that children need constant care and encouragement, and that parents don’t always have the time to provide that. You can trust our EEC certified teachers to equip your school-aged children with the best supplemental education tools so they can succeed. We offer a few different options to make your life easier: Before school care; After school care; Summer programs.";;;"YES";"NO";"http://fallbrookchilddevctr.com/files/2016/06/logo.jpg";
"Francis Wyman School After School Program";;"41 TERRACE HALL AVENUE";;"BURLINGTON";"MA";"01803";"781-270-1769";;"MIDDLESEX";;;;;;;;"http://www.burlington.org/";;"Monday - Friday";"school dismissal - 6:00 pm";;;"The Burlington Public Schools' child care programs provide a safe, engaging, and nurturing environment for families requiring quality child care for before school, after school, and summer vacation. Our mission emphasizes creating an atmosphere that balances student learning, enrichment, physical activity, and free time in a stimulating and enjoyable setting. The child care programs offered by the Burlington Schools provide parents with safe, convenient, reliable, and affordable out-of-school time care for their children. The programs maintain clear policies and procedures and actively encourage and welcome open communication and parent involvement.";;;"YES";"NO";;
"Memorial School After School Program";;"125 WINN STREET";;"BURLINGTON";"MA";"01803";"781-238-4657";;"MIDDLESEX";;;;;;;;"http://www.burlington.org/";;"Monday - Friday";"school dismissal - 6:00 pm";;;"The Burlington Public Schools' child care programs provide a safe, engaging, and nurturing environment for families requiring quality child care for before school, after school, and summer vacation. Our mission emphasizes creating an atmosphere that balances student learning, enrichment, physical activity, and free time in a stimulating and enjoyable setting. The child care programs offered by the Burlington Schools provide parents with safe, convenient, reliable, and affordable out-of-school time care for their children. The programs maintain clear policies and procedures and actively encourage and welcome open communication and parent involvement.";;;"YES";"NO";;
"Fox Hill School After School Program";;"1 FOX HILL RD";;"BURLINGTON";"MA";"01803";"781-238-5666";;"MIDDLESEX";;;;;;;;"http://www.burlington.org/";;"Monday - Friday";"school dismissal - 6:00 pm";;;"The Burlington Public Schools' child care programs provide a safe, engaging, and nurturing environment for families requiring quality child care for before school, after school, and summer vacation. Our mission emphasizes creating an atmosphere that balances student learning, enrichment, physical activity, and free time in a stimulating and enjoyable setting. The child care programs offered by the Burlington Schools provide parents with safe, convenient, reliable, and affordable out-of-school time care for their children. The programs maintain clear policies and procedures and actively encourage and welcome open communication and parent involvement.";;;"YES";"NO";;
"Pine Glen School After School Program";;"1 PINE GLEN WAY";;"BURLINGTON";"MA";"01803";"781-270-1714";;"MIDDLESEX";;;;;;;;"http://www.burlington.org/";;"Monday - Friday";"school dismissal - 6:00 pm";;;"The Burlington Public Schools' child care programs provide a safe, engaging, and nurturing environment for families requiring quality child care for before school, after school, and summer vacation. Our mission emphasizes creating an atmosphere that balances student learning, enrichment, physical activity, and free time in a stimulating and enjoyable setting. The child care programs offered by the Burlington Schools provide parents with safe, convenient, reliable, and affordable out-of-school time care for their children. The programs maintain clear policies and procedures and actively encourage and welcome open communication and parent involvement.";;;"YES";"NO";;
"Bedford Kids' Club";;"12 MUDGE WAY ";;"BEDFORD";"MA";" 01730";"781-275-5427";240;"MIDDLESEX";;;;"Will";"Vallely";;;"https://www.bedfordma.gov/";;"Monday - Friday";"7:00am - 9:00am | end of school day - 6:00pm";;;"Bedford Recreation KIDS' CLUB is a school-age care program located at the Town Center (in the same complex as the Police Station and Town Hall).";;"Before School $12; After School $30; School Vacation and Teacher Workshop Days $65; Summer Fun Full Day $65; Summer Fun Half Day Mornings (7am-12:30pm) $40; Summer Fun Half Day Afternoon (12:30 pm-6pm) $40";"YES";"NO";;
"Boys & Girls Clubs of Metropolitan Baltimore - Brooklyn O'Malley Unit";;"3560 3rd St";;"Baltimore";"MD";" 21225";"443-312-6289";;"BALTIMORE CITY";;;;;;"6–18";;"http://www.bgcmetrobaltimore.org/";;"Monday - Friday";"2:00pm-6:00pm (6-12 years), 6:00pm-8:00pm (teens)";;;"Since 2007, the Boys & Girls Clubs of Metropolitan Baltimore (BGCMB) has been serving at risk children and families of Baltimore. BGCMB annually serves over 5,200 children & youth ages 6 to 18, who live in some of Baltimore’s most severely distressed communities. Close to 600 youth pass through the doors of Club sites each day!";;;"YES";"NO";;
"Boys & Girls Clubs of Metropolitan Baltimore - O'Donnell Heights Unit";;"1200 Gusryan St";;"Baltimore";"MD";" 21224";"443-503-5101";;"BALTIMORE CITY";;;;;;"6–18";;"http://www.bgcmetrobaltimore.org/";;"Monday - Friday";"2:00pm-6:00pm (6-12 years), 6:00pm-8:00pm (teens)";;;"Since 2007, the Boys & Girls Clubs of Metropolitan Baltimore (BGCMB) has been serving at risk children and families of Baltimore. BGCMB annually serves over 5,200 children & youth ages 6 to 18, who live in some of Baltimore’s most severely distressed communities. Close to 600 youth pass through the doors of Club sites each day!";;;"YES";"NO";;
"Boys & Girls Clubs of Metropolitan Baltimore - Juvenile Justice Center";;"300 N Gay St";;"Baltimore";"MD";" 21202";"443-854-6723";;"BALTIMORE CITY";;;;;;"6–18";;"http://www.bgcmetrobaltimore.org/";;"Monday - Sunday";"3:00pm-7:00pm (M-F), 9:00am-5:00pm (S-S)";;;"Since 2007, the Boys & Girls Clubs of Metropolitan Baltimore (BGCMB) has been serving at risk children and families of Baltimore. BGCMB annually serves over 5,200 children & youth ages 6 to 18, who live in some of Baltimore’s most severely distressed communities. Close to 600 youth pass through the doors of Club sites each day!";;;"YES";"NO";;
"Boys & Girls Clubs of Metropolitan Baltimore - Westport Homes Club";;"2343 Norfolk St";;"Baltimore";"MD";"21230";"443-231-8465";;"BALTIMORE CITY";;;;;;"6–12";;"http://www.bgcmetrobaltimore.org/";;"Monday - Friday";"2:00pm-6:00pm (6-12 years)";;;"Since 2007, the Boys & Girls Clubs of Metropolitan Baltimore (BGCMB) has been serving at risk children and families of Baltimore. BGCMB annually serves over 5,200 children & youth ages 6 to 18, who live in some of Baltimore’s most severely distressed communities. Close to 600 youth pass through the doors of Club sites each day!";;;"YES";"NO";;
"Boys & Girls Clubs of Metropolitan Baltimore - Webster Kendrick Unit";;"4130 Callaway Ave";;"Baltimore";"MD";"21215";"410-664-7598";;"BALTIMORE CITY";;;;;;"6–18";;"http://www.bgcmetrobaltimore.org/";;"Monday - Friday";"2:00pm-6:00pm (6-12 years), 6:00pm-8:00pm (teens)";;;"Since 2007, the Boys & Girls Clubs of Metropolitan Baltimore (BGCMB) has been serving at risk children and families of Baltimore. BGCMB annually serves over 5,200 children & youth ages 6 to 18, who live in some of Baltimore’s most severely distressed communities. Close to 600 youth pass through the doors of Club sites each day!";;;"YES";"NO";;
"Boys & Girls Clubs of Metropolitan Baltimore - Towanda Extension Site";;"4100 Towanda Avenue";;"Baltimore";"MD";"21215";"443-984-2375";;"BALTIMORE CITY";;;;;;"6–12";;"http://www.bgcmetrobaltimore.org/";;"Monday - Friday";"2:00pm-6:00pm (6-12 years)";;;"Since 2007, the Boys & Girls Clubs of Metropolitan Baltimore (BGCMB) has been serving at risk children and families of Baltimore. BGCMB annually serves over 5,200 children & youth ages 6 to 18, who live in some of Baltimore’s most severely distressed communities. Close to 600 youth pass through the doors of Club sites each day!";;;"YES";"NO";;
"Boys & Girls Club at Wiley H. Bates Heritage Park";;"121 S. Villa Avenue";;"Annapolis";"MD";" 21401";"410-263-2542";;"ANNE ARUNDEL";"JPindell@bgcaa.com";;;"Jon ""Wes"" ";"Pindell";;;"https://www.bgcaa.org/";;"Monday - Friday";"2:00pm-7:00pm";;;"Referred to as the ""Bates Club"" this Club has caring staff to inspire youth and an abundance of activities to captivate children from all walks of life. This Club offers access to a brand new turf field, a full length basketball court, a dance stage/theatre, tech lab and games room complete with flat screen TVs and pool tables. This Club also makes use of a large, interactive, Smart Board for educational and programming purposes. Bates is also the home of our Administration Offices. It is located next to the Senior Center - keep driving through the Senior Center parking lot to get to the Club entrance. ";;;"YES";"NO";"https://irp-cdn.multiscreensite.com/b1989439/dms3rep/multi/desktop/ANNAPOLIS_ANNE%20ARUNDEL%20COUNTY-11-986x228.png";
"Boys & Girls Club at Bywater";;"1903 Copeland St.";;"Annapolis";"MD";"21401";"410-269-7648";;"ANNE ARUNDEL";"EBeavers@bgcaa.com";;;"Erick";"Beavers";;;"https://www.bgcaa.org/";;"Monday - Friday";"2:00pm-7:00pm";;;"The Bywater Boys & Girls Club is a safe place where kids can have fun and learn. Bywater has an award winning FIRST Lego League Robotics team and was the first Club to open it's doors back in 1988. ";;;"YES";"NO";"https://irp-cdn.multiscreensite.com/b1989439/dms3rep/multi/desktop/ANNAPOLIS_ANNE%20ARUNDEL%20COUNTY-11-986x228.png";
"Boys & Girls Club at Admiral Oaks";;"417C Captain's Circle";;"Annapolis";"MD";" 21401";"410-280-1371";;"ANNE ARUNDEL";"aeverett@bgcaa.com";;;"Andre";"Everett";;;"https://www.bgcaa.org/";;"Monday - Friday";"2:00pm-7:00pm";;;"In May 2011, the Boys & Girls Club at Admiral Oaks reopened in a larger facility to accommodate the ever growing membership. Formerly, the Club was situated in lower level apartment, but thanks to the Community Preservation and Development Corporation (CPDC) the Club was able to expand into a refurbished community center in 2011.  This Club is convenient for all youth in the Admiral Oaks community and all Club members and staff feel like family. ";;;"YES";"NO";"https://irp-cdn.multiscreensite.com/b1989439/dms3rep/multi/desktop/ANNAPOLIS_ANNE%20ARUNDEL%20COUNTY-11-986x228.png";
"Boys & Girls Club at Freetown Village";;"7820 Darrell Henry";;"Pasadena";"MD";" 21122";"410-437-0880";;"ANNE ARUNDEL";"AWhite@bgcaa.com";;;"Angela";"White";;;"https://www.bgcaa.org/";;"Monday - Friday";"2:00pm-7:00pm";;;"The Freetown Village Boys & Girls Club focuses on youth but also has a dynamic teen program which is dedicated and committed to making a difference in the Club and the community. The Freetown Village Club was awarded a grant for their Money Matter Program which was highlighted in the BGCA Money Matters: Make it Count newsletter. The Freetown Village Club's Triple Play Leadership Club was one of the Olympic Day Winners - giving them opportunity to attend the 2014 Triple Play Leadership Club Summit at the Olympic Training Center in Colorado Springs, CO. Their Keystone Club raised over $7,000 dollars to attend the Keystone Conference and this Leadership Club partnered with the Maryland Food Bank to sponsor  food giveaways for the community and surrounding area.";;;"YES";"NO";"https://irp-cdn.multiscreensite.com/b1989439/dms3rep/multi/desktop/ANNAPOLIS_ANNE%20ARUNDEL%20COUNTY-11-986x228.png";
"Boys & Girls Club at Meade Village";;"1710 Meade Village Circle";;"Severn";"MD";" 21144";"410-551-9241 ";;"ANNE ARUNDEL";"NClark@bgcaa.com";;;"Nakita";"Clark";;;"https://www.bgcaa.org/";;"Monday - Friday";"2:00pm-7:00pm";;;"At the Meade Village Club kids and teens are encouraged to tap into their inner athlete as well as their inner Picasso. Those that attend the Meade Village Club are able to express the amazing talents that they already have and also learn and discover new ones that they didn't know about. The Club provides daily homework help ensuring that all members stay on track at school and continue too improve. The Meade Village Club hosts both a Torch Club and a Keystone Club allowing our members to give back to the community and area that they live in as well as develop strong leadership skills.";;;"YES";"NO";"https://irp-cdn.multiscreensite.com/b1989439/dms3rep/multi/desktop/ANNAPOLIS_ANNE%20ARUNDEL%20COUNTY-11-986x228.png";
"The Salvation Army Boys & Girls Clubs - Franklin Square Club";;"215 N. Calhoun Street";;"Baltimore";"MD";"21223";"410-728-4888";;"BALTIMORE CITY";;;;"Windy";"Chavis";"6–18";;"http://salvationarmymwv.org/centralmaryland/bg-clubs/boysandgirlsclub/";;;;;;"The Salvation Army operates three Boys & Girls Clubs throughout central Maryland which provide children and youth with educational, spiritual, and recreational programs. Clubs offers children and youth an opportunity to interact with their peers in a structured and supervised environment. Each of the three Salvation Army Boys & Girls Clubs in Central Maryland, Franklin Square, Middle River and Glen Burnie, work collectively with families, schools, and outside agencies to provide at-risk youth, ages 6 to 18, with fun educational, recreational, cultural, and technological experiences, helping them to build new friendships, learn new skills, and explore their own talents and strengths. Programs provided also promote teamwork, healthy lifestyle choices, and community involvement. Our B&G clubs offer a variety of after school and summer programs.Performance activities also are offered, including drama and dance. Functional living skills provide instruction on nutrition, basic cooking, the value of money, and buying foods at the grocery store. Community outreach includes dinners and social events for parents and the general community, as well as service within the neighborhood. In addition to the formal programs, onsite libraries and computer labs help foster academic achievement. Board games, billiards, table tennis, and table hockey are available, as well as a teen room and informal, age-appropriate rap sessions in which participants can feel safe about sharing their questions and experiences.";;;"YES";"NO";;
"The Salvation Army Boys & Girls Clubs - Glen Burnie Club";;"511 S. Crain Highway";;"Glen Burnie";"MD";"21060";"410-768-3482";;"ANNE ARUNDEL";;;;"Windy";"Chavis";"6–18";;"http://salvationarmymwv.org/centralmaryland/bg-clubs/boysandgirlsclub/";;;;;;"The Salvation Army operates three Boys & Girls Clubs throughout central Maryland which provide children and youth with educational, spiritual, and recreational programs. Clubs offers children and youth an opportunity to interact with their peers in a structured and supervised environment. Each of the three Salvation Army Boys & Girls Clubs in Central Maryland, Franklin Square, Middle River and Glen Burnie, work collectively with families, schools, and outside agencies to provide at-risk youth, ages 6 to 18, with fun educational, recreational, cultural, and technological experiences, helping them to build new friendships, learn new skills, and explore their own talents and strengths. Programs provided also promote teamwork, healthy lifestyle choices, and community involvement. Our B&G clubs offer a variety of after school and summer programs.Performance activities also are offered, including drama and dance. Functional living skills provide instruction on nutrition, basic cooking, the value of money, and buying foods at the grocery store. Community outreach includes dinners and social events for parents and the general community, as well as service within the neighborhood. In addition to the formal programs, onsite libraries and computer labs help foster academic achievement. Board games, billiards, table tennis, and table hockey are available, as well as a teen room and informal, age-appropriate rap sessions in which participants can feel safe about sharing their questions and experiences.";;;"YES";"NO";;
"The Salvation Army Boys & Girls Clubs - Middle River Club";;"1400 Fuselage Avenue";;"Baltimore";"MD";"21220";"410-682-2450";;"BALTIMORE CITY";;;;"Windy";"Chavis";"6–18";;"http://salvationarmymwv.org/centralmaryland/bg-clubs/boysandgirlsclub/";;;;;;"The Salvation Army operates three Boys & Girls Clubs throughout central Maryland which provide children and youth with educational, spiritual, and recreational programs. Clubs offers children and youth an opportunity to interact with their peers in a structured and supervised environment. Each of the three Salvation Army Boys & Girls Clubs in Central Maryland, Franklin Square, Middle River and Glen Burnie, work collectively with families, schools, and outside agencies to provide at-risk youth, ages 6 to 18, with fun educational, recreational, cultural, and technological experiences, helping them to build new friendships, learn new skills, and explore their own talents and strengths. Programs provided also promote teamwork, healthy lifestyle choices, and community involvement. Our B&G clubs offer a variety of after school and summer programs.Performance activities also are offered, including drama and dance. Functional living skills provide instruction on nutrition, basic cooking, the value of money, and buying foods at the grocery store. Community outreach includes dinners and social events for parents and the general community, as well as service within the neighborhood. In addition to the formal programs, onsite libraries and computer labs help foster academic achievement. Board games, billiards, table tennis, and table hockey are available, as well as a teen room and informal, age-appropriate rap sessions in which participants can feel safe about sharing their questions and experiences.";;;"YES";"NO";;
"Boys & Girls Clubs of Southern Maryland";;"9021 Dayton Avenue";;"North Beach";"MD";" 20714";"410-286-9880";;"CALVERT";"info@bgcsm.net";;;;;"6–18";;"http://bgcsm.net/";;"Monday - Friday";"Regular hours: 2:00pm-6:00pm; Summer hours: Before Care: 7:30am-9:00am, Camp Hours: 9:00am-4:30pm; After Care: 4:30pm-6:00pm";;;"BGCSM Mission: To inspire and enable all young people, especially those who need us most, to realize their full potential as productive, responsible and caring citizens.";;"An annual membership is only $25.  After School fees are $25 per week. ";"YES";"NO";"http://bgcsm.net/wp-content/uploads/2012/01/New-Picture.png";
"BGCGW - Germantown Club";;"19910 Frederick Road";;"Germantown";"MD";20876;"301-353-9600";;"MONTGOMERY";"pmcmanus@bgcgw.org ";;;"Phil";"McManus";"5–18";;"https://www.bgcgw.org/";;"Monday - Friday";"Early Discovery Hours: 7:00am-9:00pm, Project Discovery Hours: 2:30pm-7:30pm; Summer Hours: 6:00am-6:00pm";;;"Since October 18, 2002, the Boys & Girls Clubs of Greater Washington (BGCGW) Germantown Club has been providing quality before and after school programs, as well as summer camp programs, for the youths of the Germantown, Gaithersburg, and Clarksburg community. We serve over 550 youths throughout the year, with an average daily attendance of 120 club members. Our programs serve children ages 5 – 18 (Kindergarten – 12th Grade). Our dedicated and caring staff provides high-yield learning activities in eight different classrooms. The facilities include a Learning Center, Arts & Crafts Room, Technology Lab, Health & Life Skills Room, Games Room, Gymnasium, and Teen Center.";;"Early Discovery (Morning Program), automatically includes Project Discovery = $350.00/per month/per child, Membership Fee = $25.00/per year/per child; Project Discovery (After School Program) = $125.00/per month/per child, Membership Fee = $25.00/per year/per child.";"YES";"NO";"https://www.bgcgw.org/wp-content/uploads/2016/07/BGCGW_logo.png";
"BGCGW - Drew-Freeman Middle School Club";;"2600 Brooks Drive";;"Suitland";"MD";20746;"301-233-0424";;"PRINCE GEORGE'S";"operations@bgcgw.org";;;"Kamilah";"Wheeler";;;"https://www.bgcgw.org/";;"Monday - Friday";"School Year Hours: 3:30pm-7:30pm, Summer Hours: 7:00am-5:30pm";;;"The Club provides afterschool programs for an average of 300 youth daily at Drew Freeman Middle School. The Club provides core programs in the following areas: Homework Assistance; Character Development for S.M.A.R.T. Girls; Manhood Training for Boys; Recreational programs that focus on improving health and wellness.";;;"YES";"NO";"https://www.bgcgw.org/wp-content/uploads/2016/07/BGCGW_logo.png";
"Boys & Girls Clubs of Harford County - Aberdeen";;"100 E. Bel Air Ave.";;"Aberdeen";"MD";21001;"410-272-8233";;"HARFORD";"obrannigan@bgcharfordco.org";;;"Otelia";"Brannigan";;;"http://www.bgcharfordco.org/";;"Monday - Friday";"School Year Hours: 2:30pm-8:00pm (Weekdays), Teens ONLY: 6:00pm-8:00pm";;;"In every community, boys and girls are left to find their own recreation and companionship in the critical after school hours. It is at these times that many young people become introduced to or participate in unhealthy activities. To combat this, the Boys & Girls Clubs of Harford County provides services to these youth to offer a healthy alternative.";;"Membership: $20 per school year";"YES";"NO";;
"Boys & Girls Clubs of Harford County - Bel Air";;"525 W. MacPhail Rd.";;"Bel Air";"MD";21014;"410-838-3354";;"HARFORD";"jkirksey@bgcharfordco.org";;;"Jalissa";"Kirksey";;;"http://www.bgcharfordco.org/";;"Monday - Friday";"School Year Hours: 2:30pm-7:00pm (Weekdays), Summer Hours: 7:30am-6:00pm (Weekdays)";;;"In every community, boys and girls are left to find their own recreation and companionship in the critical after school hours. It is at these times that many young people become introduced to or participate in unhealthy activities. To combat this, the Boys & Girls Clubs of Harford County provides services to these youth to offer a healthy alternative.";;"Membership: $20 per school year";"YES";"NO";;
"Boys & Girls Clubs of Harford County - Edgewood";;"2002 Cedar Dr.";;"Edgewood";"MD";21040;"410-676-1020";;"HARFORD";"dpryor@bgcharfordco.org";;;"David";"Pryor";;;"http://www.bgcharfordco.org/";;"Monday - Friday";"School Year: 2:30pm-8:00pm; Teens ONLY: 7:00pm-8:00pm";;;"In every community, boys and girls are left to find their own recreation and companionship in the critical after school hours. It is at these times that many young people become introduced to or participate in unhealthy activities. To combat this, the Boys & Girls Clubs of Harford County provides services to these youth to offer a healthy alternative.";;;"YES";"NO";;
"Boys & Girls Clubs of Harford County - Havre de Grace";;"351 Lewis Lane";;"Havre de Grace";"MD";21078;"410-939-0822";;"HARFORD";"achoate@bgcharfordco.org";;;"Ashley";"Choate";;;"http://www.bgcharfordco.org/";;"Monday - Friday";"2:30pm-7:00pm";;;"In every community, boys and girls are left to find their own recreation and companionship in the critical after school hours. It is at these times that many young people become introduced to or participate in unhealthy activities. To combat this, the Boys & Girls Clubs of Harford County provides services to these youth to offer a healthy alternative.";;"Membership: $20 per school year";"YES";"NO";;
