"name";"location";"address";"address2";"city";"state";"zip";"phone";"phone_ext";"county";"email";"status";"type";"contact_firstname";"contact_lastname";"age_range";"transportation";"website";"accreditation";"daysopen";"hoursopen";"typeofcare";"language";"introduction";"additionalInfo";"pricing";"is_afterschool";"is_camp";"logo";"schools_served"
"PRESCOTT YMCA AFTER SCHOOL CARE";"YMCA School Age Building";"750 Whipple Street";;"Prescott";"AZ";86301;"928-445-7221";;"YAVAPAI";;;;"Alicia";"Craig";;"YES";"http://www.prescottymca.org/";;"Monday–Friday";"Monday/Tuesday/Thursday/Friday: 3:00-6:00pm, Wednesday: 2:00-6:00pm; Early Release Days: 12:30-6:00pm; School Break / No School: 6:30am-6:00pm ";;;"The Prescott YMCA is a non-profit charitable organization that was founded locally in 1914. It is an association of persons of all ages who are united in a common effort to put Christian principles into practice through programs that build healthy spirit, mind and body for all. YMCA After School Care is designed to promote the social, emotional, physical, intellectual and recreational needs of school-age students. Weekly activities may include arts/crafts, outdoor group games, sports, homework time, music/songs, recreational swimming, indoor group work, field trip, snack and more. Students attending PUSD schools are transported by bus to Lindquist Park where staff meet them upon arrival. Afternoon snack is provided.";;"YMCA Members: $9.00 per day, Community Members: $11.00 per day; School Break / No School - YMCA Members: $19.00 per day, Community Members: $21.00 per day";"YES";"NO";"http://www.prescottymca.org/site_files/primary2_p_062812124208_Prescott_Banner.jpg";
"YMCA OF SOUTHERN ARIZONA/JACOBS/CITY YMCA PROGRAM CENTER";"Jacobs/City YMCA Program Center";"1010 West Lind Street";;"Tucson";"AZ";85705;"520-623-9211";;"PIMA";"jacobsYMCA@tucsonymca.org";;;"Kendra";"Whetton";;"YES";"http://tucsonymca.org/";;"Monday–Friday";"From school release until 6:00 P.M.";;;"At the Y, we work to create an after school program that focuses on service learning, character development, health and wellness, homework support, literacy, arts and humanities.";;;"YES";"NO";"http://tucsonymca.org/images/layout/yLogoBlue.png";
"YMCA OF SOUTHERN ARIZONA/YMCA MULCAHY/CITY CHILD CARE CENTER";"Mulcahy/City YMCA Child Care Center";"5085 S. Nogales Highway";;"Tucson";"AZ";85706;"520-838-0936";;"PIMA";"mulcahyjr@tucsonymca.org";;;;;"5–13";;"http://tucsonymca.org/";;"Monday–Friday";"6AM To School Arrival and School Dismissal to 6PM";;;"The YMCA of Southern Arizona is dedicated to improving the quality of human life and to helping all people realize their fullest potential through the development of Spirit, Mind and Body.";"Before And After School";;"YES";"NO";"http://tucsonymca.org/images/layout/yLogoBlue.png";"Drexel Elementary, Esperanza Elementary, Elvira Elementary, Gallego Basic Elementary, Liberty Elementary, Los Amigos Elementary, Los Ninos Elementary, Los Ranchitos Elementary, Mission Manor Elementary, Rivera Elementary, Rivera Elementary, Santa Clara Elementary, Grijalva Elementary, Southgate Academy, Sierra Middle, Chaparral Middle and Challenger Middle Schools"
"YMCA OF SOUTHERN ARIZONA/MULCAHY/CITY YMCA AT GREAT EXPECTATIONS ACADEMY IN SAHUARITA";"Great Expectations Academy";"1466 W. Camino Antigua";;"Sahuarita";"AZ";85629;"520-294-1449";;"PIMA";"KaylaW@tucsonymca.org";;;"Kayla";"Walker";"5–12";;"http://tucsonymca.org/";;"Monday–Friday";"From school dismissal until 6:00 P.M.";;;"The YMCA of Southern Arizona is dedicated to improving the quality of human life and to helping all people realize their fullest potential through the development of Spirit, Mind and Body.";;;"YES";"NO";"http://tucsonymca.org/images/layout/yLogoBlue.png";"Sahuarita Primary, Sahuarita Intermediate, Copper View, Anza Trail and Great Expectations Academy."
"ANGEL YOUTH CENTER";;"7770 N. Shannon Road";;"Tucson";"AZ";85741;"520-229-9001";"X113";"PIMA";"yevettes@tucsonymca.org";;;;;"8–18";;"http://tucsonymca.org/";;"Monday–Saturday";"Monday - Thursday 3:00pm - 8:30pm; Friday 3:00pm - 8:00pm (8-18 Yrs), 8:00PM -10:00 PM (13-18 yrs ONLY); Saturday 9:00am - 8:00pm";;;"After two years in the making, the moment arrived in September 2011 for the opening of the Angel Youth Center (AYC). With the support from the Angel Charity for Children, Emerald Foundation, Tucson Conquistadores and the Northwest YMCA Board, the youth and parents in our community brought to life their vision. A vision of a happen' place to develop the potential of our youth through collaborative social, educational and creative activities. The AYC is a dedicated space for youth and teens. Kids who go to the center have access to homework help, art classes, special events, fitness training, service projects, leadership training, sand volleyball, an outdoor basketball court and other programs and activities. Looking for something fun to do after school or on the weekend? Come to the Angel Youth Center at the Northwest Y. Activities include: homework help, ping-pong, foosball, video games, laptop check-out, board games and much more! The Center is FREE to Facility Members and open to Program Members and guests (day Pass Fee required if not a Facility Member). Special activities are held through out the year.";;;"YES";"NO";"http://tucsonymca.org/library/images/ayc1.png";
"TRIANGLE Y RANCH";;"34434 S. Y Camp Rd";;"Oracle";"AZ";85623;"520-884-0987";;"PINAL";"camp@tucsonymca.org";;;;;;;"http://tucsonymca.org/";;;;;;"At Tri-Y we want to provide a break from the typical routine and introduce your camper to a unique experience that gives children and teens the opportunity to discover their full potential, meet new friends, play outdoors, and create memories that last a lifetime. The well trained staff put the needs of the campers first and are committed to helping them develop the necessary interpersonal skills to be confident, healthy, and connected. Triangle Y Ranch Camp is located only 40 miles from downtown Tucson in the beautiful Catalina Mountains and has a wide variety of activities for kids and families. If you’re a first time camper, or an old pro, or if you want to experience life as a real Ranch Hand, then Tri-Y is the place to be.";"Traditional Summer Camp (Ages 7-17); Specialty Camps; Leaders-in-Training Camp (Ages 15-17); Family Getaways - Year-Round; Group Retreats";;"NO";"YES";"http://tucsonymca.org/triangle/homePageSlideShow-1.jpg";
"YMCA CHAUNCEY RANCH";;"18970 E. Old Sycamore Road";;"Mayer";"AZ";86333;"602-212-6166";;"YAVAPAI";"azycamps@vosymca.org";;;;;;;"http://azycamps.org/";;;;;;"Chauncey Ranch is a 5000-acre working ranch for kids located on the Agua Fria river surrounded by cottonwood trees, willows, green pastures, a sports field, a two-acre lake for canoeing and fishing, riding arenas and barns. Eleven enclosed cabins complete with evaporative coolers and built-in bunks ensure your campers’ comfort. Modern restroom/shower facilities serve each of the boys and girls sides of camp. Campers participate in progressive age-appropriate activities. All campers will have receive a basic introduction to horses and a trail ride with additional opportunities to do additional rides throughout the week.";"Arts and Crafts, Campfires, Ceramics, Archery, Riparian Hike, Low Ropes, High Ropes, Climbing Wall, Zip Line, Field Sports, Games, Paintball, Basketball, Horseback Trail Rides, Horseback Riding Lessons, Roping, Swimming, Rags & Leather Program, Counselor Special Interest Classes.";;"NO";"YES";"http://www.valleyymca.org/images/chauncyRanchLogo.png";
"YMCA CAMP SKY-Y";;"5725 S. Senator Hwy.";;"Prescott";"AZ";86303;"800-660-1385";;"YAVAPAI";"campskyy@vosymca.org";;;;;;;"http://azycamps.org/";;;;;;"The Sky-Y Experience Camp SKY-Y has been building friendships and making memories for over 70 years. Sky-Y Campers learn new skills and grow as individuals in a beautiful natural environment. Sky-Y offers a unique experience for a summer in the Arizona pines. Founded in 1938 YMCA Camp Sky-Y has embraced the human values of Caring, Honesty, Respect Responsibility. Campers learn and live the values in everything they do at camp. There are a wide range of programs offered at Sky-Y. Whether a camper wants to ride a mountain bike through the cool Ponderosa pines or they want to make a mug at ceramics there is something for everyone.";"Advanced Ceramics, Archery, Arts and Crafts, Bouldering, Camp Crafts, Campfires, Canoeing, Ceramics, Dance, Digglers (mountain scooters), Drama, Giant Swing, High Ropes 1, High Ropes 2, Hiking, Mountain Boards, Opening Jamboree, Paintball, Paintball Target Shooting, Pine Cone Dedication, Pool Games, Trips to Chauncey for Horseback Trail Rides, Team Challenges, Climbing Tower, Games, Sports, Overnight Camping, Rags & Leather Program, Swimming, Nature Studies, Counselor and Leadership Special Interest Classes";;"NO";"YES";"http://www.valleyymca.org/images/Sky-Y_logo.png";
"BOYS & GIRLS CLUBS OF METRO PHOENIX - JERRY COLANGELO BRANCH";;"1755 North 34th Avenue";;"Phoenix";"AZ";85009;"602-424-0410";;"MARICOPA";"lcarter@bgcmp.org";;;"Lemuel";"Carter";"5–18";;"http://www.bgcmp.org/";;"Monday–Friday";"2:30 PM-8:00 PM Monday, Tuesday, Wednesday, Friday; 2:00 PM-8:00 PM Thursdays Only";;;"The Boys & Girls Clubs of Metro Phoenix enables all young people, especially those who need us most, to reach their full potential as productive, caring, responsible citizens. The Jerry Colangelo Branch opened on March 19, 2009. Since then, the Club has become hugely popular among the local youth — average attendance per day is 195, and in 2012 the Club served nearly 24,000 meals to its members at no additional charge! Colangelo Club members gain determination and ambition, and that is evident in the work they produce — last year one teen Club member was awarded a $2,500 college scholarship from the Taco Bell Foundation for Teens. The Club is located right next to the Isaac School District.";"After School Programs; Summer Day Camp Program";"After School Programs: Annual youth membership is just $30; Annual teen membership is just $15. Summer Day Camp Program: Average cost $50 per week. Rates based on 2-4 week sessions. ";"YES";"NO";"http://bgclubs-phx.org/bgcmp/wp-content/uploads/2013/08/BGCMPColangelo-METROlogo-center-color.png";
"BOYS & GIRLS CLUBS OF METRO PHOENIX - WARNER A. GABEL BRANCH";;"1330 North 15th Street";;"Phoenix";"AZ";85006;"602-252-7968";;"MARICOPA";"jstine@bgcmp.org";;;"Josh";"Stine";"6–18";;"http://www.bgcmp.org/";;"Monday–Friday";"3:00 PM-8:00 PM Monday, Tuesday, Thursday, Friday; 1:00 PM-8:00 PM Wednesdays Only";;;"The Boys & Girls Clubs of Metro Phoenix enables all young people, especially those who need us most, to reach their full potential as productive, caring, responsible citizens. The Warner A. Gabel Branch was initially opened in 1982 in what was then a church building. The Club served the community that was left without a Club when the Butler Branch had to be torn down to allow for the I-10 freeway construction. In 1990 with the support of the Gabel family and friends, a new Warner A. Gabel Branch was inaugurated. The Club has undergone major renovations since its inception, the first beginning in 2002 and a second round in 2008. In 2012, the Gabel Branch served 20,000 nutritious meals at no additional charge to members.";"After School Programs; Summer Day Camp Program";"After School Programs: Annual youth membership is just $30; Annual teen membership is just $15; Summer Day Camp Program: Average cost $50 per week. Rates based on 2-4 week sessions.";"YES";"NO";"http://bgclubs-phx.org/bgcmp/wp-content/uploads/2013/08/BGCMPGable-METROlogo-center-color.png";
"BOYS & GIRLS CLUBS OF METRO PHOENIX - I. G. HOMES BRANCH";;"1601 W Sherman St.";;"Phoenix";"AZ";85007;"602-254-5814";;"MARICOPA";"lcarter@bgcmp.org";;;"Lemuel";"Carter";"6–18";;"http://www.bgcmp.org/";;"Monday–Friday";"2:30 PM-8:00 PM Monday, Tuesday, Thursday, Friday; 1:00 PM-8:00 PM Wednesdays Only";;;"The Boys & Girls Clubs of Metro Phoenix enables all young people, especially those who need us most, to reach their full potential as productive, caring, responsible citizens. The I.G. Homes Branch was originally built in 1958, and since then it has opened doors to opportunities to thousands of South/Central Phoenix youth. Among its many features, the Club has a dedicated Learning Center for youth members and the Lowe’s Teen Center, a separate space with activities designed specifically for teens. The Branch is also active in the community, partnering with FireStar, a neighborhood advocacy team serving Central City South neighborhoods. The I.G. Homes Branch is also adjacent to the Bob & Renee Parsons Dental Clinic, which services low income, uninsured children.";"After School Programs; Summer Day Camp Program";"After School Programs: Annual youth membership is just $30, Annual teen membership is just $15; Summer Day Camp Program: Average cost $50 per week. Rates based on 2-4 week sessions.";"YES";"NO";"http://bgclubs-phx.org/bgcmp/wp-content/uploads/2013/08/BGCMPHomes-METROlogo-center-color.png";
"BOYS & GIRLS CLUBS OF METRO PHOENIX - MLB ALL-STAR AZ D-BACKS BRANCH";;"548 W. Southern Avenue";;"Phoenix";"AZ";85041;"602-268-3486";;"MARICOPA";"ntorrez@bgcmp.org";;;"Nicole";"Torrez";"6–18";;"http://www.bgcmp.org/";;"Monday–Friday";"2:30 PM-8:00 PM Monday, Tuesday, Wednesday, Thursday; 12:30 PM-8:00 PM Fridays Only";;;"The Boys & Girls Clubs of Metro Phoenix enables all young people, especially those who need us most, to reach their full potential as productive, caring, responsible citizens. First opened in 1958 as the Herbert Kieckhefer Branch, this Club has served the South Phoenix community for more than a half a century. In 2011, thanks to the generous support of Major League Baseball, the All-Star Game, and the Arizona Diamondbacks, the Branch underwent a complete renovation and reopened as the MLB All-Star Arizona Diamondbacks Branch: A Kieckhefer Family Legacy. Some of the programs include partnerships with the South Mountain Coalition Works Committee, Phoenix Police, Audubon Society, and the Arizona Diamondbacks (who sponsored last year’s holiday party).";"After School Programs; Summer Day Camp Program";"After School Programs: Annual youth membership is just $30, Annual teen membership is just $15; Summer Day Camp Program: Average cost $50 per week. Rates based on 2-4 week sessions.";"YES";"NO";"http://bgclubs-phx.org/bgcmp/wp-content/uploads/2013/08/BGCMPDbacks-METROlogo-center-color.png";
"BOYS & GIRLS CLUBS OF METRO PHOENIX - JERRY & HELEN WISOTSKY/PEORIA BRANCH";;"11820 N. 81st Ave";;"Peoria";"AZ";85345;"623-979-3559";;"MARICOPA";"hbudzien@bgcmp.org";;;"Heather";"Budzien";"6–18";;"http://www.bgcmp.org/";;"Monday–Friday";"3:00 PM-8:00 PM Monday, Tuesday, Thursday, Friday; 2:00 PM-8:00 PM Wednesday Only";;;"The Boys & Girls Clubs of Metro Phoenix enables all young people, especially those who need us most, to reach their full potential as productive, caring, responsible citizens. Boys & Girls Club of Metro Phoenix has had a presence in Peoria since 1975, but our Wistosky Branch wasn’t built until 1981. The Club serves a very diverse population and last year served a total of 1,647 youths. In the past few years the Club has undergone some major improvements: in 2010 the gym got a major renovation; in 2011, as part of a “go green” platform funded by the Arizona Office of Energy Efficiency, Wisotsky/Peoria became the first BGCMP location to install solar panels on the roof; and in 2012 the University of Phoenix funded the creation of the Reading Nook. The Club is located near Peoria and Centennial High Schools.";"After School Programs; Summer Day Camp Program";"After School Programs: Annual youth membership is just $30, Annual teen membership is just $15; Summer Day Camp Program: Average cost $50 per week. Rates based on 2-4 week sessions. ";"YES";"NO";"http://bgclubs-phx.org/bgcmp/wp-content/uploads/2013/08/BGCMPPeoria-METROlogo-center-color.png";
"BOYS & GIRLS CLUBS OF METRO PHOENIX - ED ROBSON FAMILY BRANCH";;"15815 N. 29th St.";;"Phoenix";"AZ";85032;"602-449-2850";;"MARICOPA";"jstine@bgcmp.org";;;"Josh";"Stine";"6–18";;"http://www.bgcmp.org/";;"Monday–Friday";"3:00 PM-8:00 PM";;;"The Boys & Girls Clubs of Metro Phoenix enables all young people, especially those who need us most, to reach their full potential as productive, caring, responsible citizens. The Ed Robson Family Branch opened on December 3, 2008 and provides over 25,000 square feet for Boys & Girls Clubs of Metro Phoenix programs. In 2012 the Club had 976 enrolled members and, including outreach campaigns, served nearly 2,000 community youths! The past couple years have seen the introduction of some great new programs including UPS Road Code Driver Education Program and Teen Court through the City of Phoenix Prosecutors’ Office. At the Club, kids receive the opportunities they need to succeed and to become everything they have dreamed about. The Club is located in North Phoenix between the Palomino I and Palomino II schools.";"After School Programs; Summer Day Camp Program";"After School Programs: Annual youth membership is just $30, Annual teen membership is just $15; Summer Day Camp Program: Average cost $50 per week. Rates based on 2-4 week sessions.";"YES";"NO";"http://bgclubs-phx.org/bgcmp/wp-content/uploads/2013/08/BGCMPRobson-METROlogo-center-color.png";
"BOYS & GIRLS CLUBS OF METRO PHOENIX - HARRY & SANDY ROSENZWEIG BRANCH";;"2242 W Missouri Avenue";;"Phoenix";"AZ";85061;"602-249-1338";;"MARICOPA";"wcherekos@bgcmp.org";;;"Whitney";"Cherekos";"6–18";;"http://www.bgcmp.org/";;"Monday–Friday";"2:00 PM-8:00 PM Monday, Tuesday, Thursday, Friday; 1:00 PM-8:00 PM Wednesday";;;"The Boys & Girls Clubs of Metro Phoenix enables all young people, especially those who need us most, to reach their full potential as productive, caring, responsible citizens. Built in 1958, the Club initially opened its doors as the Agnes Miller Unit. The Club was rededicated in 1984 as the Harry & Sandy Rosenzweig Branch. The Rosenzweig Branch has undergone several renovations, the most recent of which took place in 2004 and included the addition of a Teen Center complete with a Learning Center and half basketball court. In 2012, the Club served over 1,850 youths of northwest Phoenix with engaging, educational programs including partnerships with Homeward Bound and the Phoenix Police Department.";"After School Programs; Summer Day Camp Program";"After School Programs: Annual youth membership is just $30, Annual teen membership is just $15; Summer Day Camp Program: Average cost $50 per week. Rates based on 2-4 week sessions.";"YES";"NO";"http://bgclubs-phx.org/bgcmp/wp-content/uploads/2013/08/BGCMPRosenzweig-METROlogo-center-color.png";
"BOYS & GIRLS CLUBS OF METRO PHOENIX - LOUIS & ELIZABETH SANDS BRANCH";;"4730 W Grovers Avenue";;"Glendale";"AZ";85308;"602-375-0400";;"MARICOPA";"wcherekos@bgcmp.org";;;"Whitney";"Cherekos";"6–18";;"http://www.bgcmp.org/";;"Monday–Friday";"6:30 AM-8:45 AM; 2:00 PM-8:00 PM";;;"The Boys & Girls Clubs of Metro Phoenix enables all young people, especially those who need us most, to reach their full potential as productive, caring, responsible citizens. The Louis & Elizabeth Sands Branch was built in 1985 and opened its doors in 1986. The Sands Branch is located in an area of the Valley with many kids, and over 200 young people attend the Club every day. In addition to the traditional after-school programming, Sands also offers a Before School Program starting at 6:30 AM. The Branch is conveniently located across the street from a local elementary school, making it easily accessible.";"After School Programs; Summer Day Camp Program; Before School Program";"After School Programs: Annual youth membership is just $30, Annual teen membership is just $15; Summer Day Camp Program: Average cost $65 per week. Rates based on 2-4 week sessions. ";"YES";"NO";"http://bgclubs-phx.org/bgcmp/wp-content/uploads/2013/08/BGCMPSands-METROlogo-center-color.png";
"BOYS & GIRLS CLUBS OF METRO PHOENIX - SPENCER D. & MARY JANE STEWART BRANCH";;"6629 W. Clarendon Ave";;"Phoenix";"AZ";85033;"623-848-1022";;"MARICOPA";"hbudzien@bgcmp.org";;;"Heather";"Budzien";"6–18";;"http://www.bgcmp.org/";;"Monday–Friday";"2:30 PM-8:00 PM Monday, Tuesday, Friday; 12:00 PM-8:00 PM Wednesdays Only; 1:15 PM-8:00 PM Thursdays Only";;;"The Boys & Girls Clubs of Metro Phoenix enables all young people, especially those who need us most, to reach their full potential as productive, caring, responsible citizens. The Spencer D. & Mary Jane Stewart branch was built in 1986 on land donated by the John F. Long Foundation. In 2006 and 2007 the Club underwent a major restoration, updating many of the building’s amenities, including providing a new floor and scoreboard for the gym. The Club partners with local public schools, Maryvale YMCA, and Maryvale Police to offer fun and educational programs to youth and teens.";"After School Programs; Summer Day Camp Program";"After School Programs: Annual youth membership is just $30, Annual teen membership is just $15; Summer Day Camp Program: Average cost $50 per week. Rates based on 2-4 week sessions. ";"YES";"NO";"http://bgclubs-phx.org/bgcmp/wp-content/uploads/2013/08/BGCMPStewart-METROlogo-center-color.png";
"BOYS & GIRLS CLUBS OF METRO PHOENIX - SWIFT KIDS BRANCH";;"6420 W Maryland Ave";;"Glendale";"AZ";85301;"623-939-6952";;"MARICOPA";"ntorrez@bgcmp.org";;;"Nicole";"Torrez";"6–18";;"http://www.bgcmp.org/";;"Monday–Friday";"3:00 PM-8:00 PM Monday, Tuesday, Thursday, Friday; 12:00 PM-8:00 PM Wednesdays Only";;;"The Boys & Girls Clubs of Metro Phoenix enables all young people, especially those who need us most, to reach their full potential as productive, caring, responsible citizens. The Swift Kids Branch hosted a grand opening celebration on Wednesday, October 8th 2008. The Club serves nearly 1,600 community youth, 735 of whom are BGCMP Members. Some of the programs offered at Swift Kids Branch include UPS Road Code — a driver’s education course with UPS instructors and driving simulators, Camp Swift – offering traditional camp experiences in Prescott as well as after school and day camps, and, in collaboration with local schools, Rosetta Stone computer programs are available two days a week for parents who wish to learn English. The Club is located next to the Harold W. Smith School.";"After School Programs; Summer Day Camp Program";"After School Programs: Annual youth membership is just $30, Annual teen membership is just $15; Summer Day Camp Program: Average cost $50 per week. Rates based on 2-4 week sessions. ";"YES";"NO";"http://bgclubs-phx.org/bgcmp/wp-content/uploads/2013/08/BGCMPSwift-METROlogo-center-color.png";
"BOYS & GIRLS CLUBS OF METRO PHOENIX - WOODROW C. SCOUTTEN/TOLLESON BRANCH";;"9251 W Washington St.";;"Tolleson";"AZ";85353;"623-936-9020";;"MARICOPA";"gszostak@bgcmp.org";;;"Gerald";"Szostak";"6–18";;"http://www.bgcmp.org/";;"Monday–Friday";"2:30 PM-8:00 PM Monday, Tuesday, Wednesday & Friday; 1:00 PM-8:00 PM Wednesdays Only";;;"The Boys & Girls Clubs of Metro Phoenix enables all young people, especially those who need us most, to reach their full potential as productive, caring, responsible citizens. The Tolleson Branch was built in 1988. The Club is operated in cooperation with the City of Tolleson which owns the facility while the Boys & Girls Clubs of Metro Phoenix run the programs. The Branch also partners with local organizations for an array of top quality programs and events. In the summer of 2012 the gym floor was entirely renovated. Each day the Branch offers a complete meal for its members, and last year served a total of 17,800 meals.";"After School Programs; Summer Day Camp Program";"After School Programs: Annual youth membership is just $30, Annual teen membership is just $15; Summer Day Camp Program: Average cost $50 per week. Rates based on 2-4 week sessions.";"YES";"NO";"http://bgclubs-phx.org/bgcmp/wp-content/uploads/2013/08/BGCMPTolleson-METROlogo-center-color.png";
"BOYS & GIRLS CLUBS OF METRO PHOENIX - TRI-CITY WEST THORNWOOD BRANCH";;"301 E Western Avenue";;"Avondale";"AZ";85323;"623-932-1154";;"MARICOPA";"gzostak@bgcmp.org";;;"Gerald";"Szostak";"6–18";;"http://www.bgcmp.org/";;"Monday–Friday";"2:00 PM-8:00 PM Monday, Tuesday, Thursday, Friday; 12:00 PM-8:00 PM Wednesdays Only";;;"The Boys & Girls Clubs of Metro Phoenix enables all young people, especially those who need us most, to reach their full potential as productive, caring, responsible citizens. The Tri-City West Thornwood Branch was first opened in a temporary facility in 1993 and took residence in its permanent home in 1998. The Club operates with strong support of the cities of Avondale, Litchfield Park, and Goodyear. The Club operates dozens of incredible programs, including partnerships with Garden Patch, the Cincinnati Reds and the Cleveland Indians.";"After School Programs; Summer Day Camp Program";"After School Programs: Yearly access to all after school programs is just $30; Summer Day Camp Program: Average cost $50 per week. Rates based on 2-4 week sessions. ";"YES";"NO";"http://bgclubs-phx.org/bgcmp/wp-content/uploads/2013/08/BGCMPTriCity-METROlogo-center-color.png";
